{
  "$schema": "http://json-schema.org/draft-07/schema#",
  "title": "PolicyBundle",
  "type": "object",
  "required": ["version", "rules"],
  "additionalProperties": false,
  "properties": {
    "version": { "type": "integer", "minimum": 1 },
    "meta": { "type": "object", "additionalProperties": { "type": "string" } },
    "defaults": {
      "type": "object",
      "additionalProperties": false,
      "properties": {
        "default_action": { "enum": ["allow", "deny"] },
        "max_body_bytes": { "type": "integer", "minimum": 0, "maximum": 1048576 }
      }
    },
    "rules": {
      "type": "array",
      "items": { "$ref": "#/definitions/rule" }
    }
  },
  "definitions": {
    "rule": {
      "type": "object",
      "required": ["id", "when", "action"],
      "additionalProperties": false,
      "properties": {
        "id": { "type": "string", "minLength": 1 },
        "when": {
          "type": "object",
          "additionalProperties": false,
          "properties": {
            "tenant": { "type": "string" },
            "method": { "type": "string" },
            "region": { "type": "string" },
            "max_body_bytes": { "type": "integer", "minimum": 0, "maximum": 1048576 },
            "require_tags_all": { "type": "array", "items": { "type": "string" } }
          }
        },
        "action": { "enum": ["allow", "deny"] },
        "obligations": {
          "type": "array",
          "items": { "$ref": "#/definitions/obligation" }
        },
        "reason": { "type": "string" }
      }
    },
    "obligation": {
      "type": "object",
      "required": ["kind"],
      "additionalProperties": false,
      "properties": {
        "kind": {
          "type": "string",
          "minLength": 1,
          "not": {
            "pattern": "([Ii]ssue|[Tt]ransfer|[Bb]urn|[Mm]int[_-]?[Rr][Oo][Cc]|[Aa]llocate[_-]?[Rr][Oo][Cc]|[Cc]reate[_-]?[Rr]eceipt|[Pp]ut[_-]?[Rr]eceipt|[Ii]nsert[_-]?[Rr]eceipt|[Aa]ccept[_-]?[Rr]eceipt|[Cc]ommit[_-]?[Rr]eceipt|[Ff]inalize[_-]?[Rr]eceipt|[Mm]utate[_-]?[Bb]alance|[Ss]et[_-]?[Bb]alance|[Cc]redit[_-]?[Aa]ccount|[Dd]ebit[_-]?[Aa]ccount|[Uu]nlock[_-]?[Pp]aid[_-]?[Cc]ontent|[Pp]rove[_-]?[Pp]ayment[_-]?[Ff]inality|[Pp]roduce[_-]?[Cc]heckpoint|[Pp]roduce[_-]?[Rr]oot|[Ss]ettlement[_-]?[Cc]omplete|[Ss]ettlement[_-]?[Ff]inalized|[Bb]ridge[_-]?[Ss]ettlement)"
          }
        },
        "params": {
          "type": "object",
          "propertyNames": {
            "not": {
              "pattern": "^([Rr]eceipt[_-]?[Ii][Dd]|[Rr]eceipt[_-]?[Hh]ash|[Rr]eceipt[_-]?[Rr]oot|[Bb]alance|[Bb]alance[_-]?[Mm]inor|[Ww]allet[_-]?[Bb]alance|[Ll]edger[_-]?[Bb]alance|[Ff]inality|[Ff]inalized|[Uu]nlock[_-]?[Gg]ranted|[Pp]aid[_-]?[Pp]roof|[Ss]ettlement[_-]?[Ss]tatus|[Ss]pend[_-]?[Aa]uthority|[Cc]apture[_-]?[Aa]uthority|[Ss]tate[_-]?[Rr]oot|[Cc]heckpoint[_-]?[Rr]oot|[Cc]heckpoint[_-]?[Hh]ash|[Vv]alidator[_-]?[Ss]ignature|[Mm]int[_-]?[Aa]uthority)$"
            }
          },
          "additionalProperties": { "type": "string" }
        }
      }
    }
  }
}
